{
  "$schema": "https://schemas.skilland.ai/skilland-crm-ops/v1/capability-registry.schema.json",
  "schemaVersion": "1.0.0",
  "registryVersion": "1.1.0",
  "policyVersion": "1.2.0",
  "registryId": "skilland-crm-ops.capabilities",
  "repoId": "skilland-crm",
  "canonicalCapabilityCount": 38,
  "legacyResolvableIdCount": 39,
  "policyDefaults": {
    "unknownCapability": "denied",
    "unknownField": "denied",
    "ambiguousEnvironment": "denied",
    "destructive": "denied",
    "metadataMutation": "denied",
    "workflowActivation": "denied",
    "productionWriteRequiresPlanBoundApproval": true,
    "externalSendApprovalTier": "two_stage",
    "accountingEffectApprovalTier": "two_stage",
    "crossDomainCrmWritebackApprovalTier": "two_stage"
  },
  "capabilities": [
    {
      "id": "crm.metadata.read",
      "domain": "crm",
      "ownerComponent": "crm-core",
      "routingExposure": "internal",
      "lifecycleStatus": "active",
      "semanticMaturity": "partial",
      "runtimeReadiness": "read_only",
      "frontDoorReadiness": "not_implemented",
      "testLevel": "unknown",
      "evidence": [
        {
          "type": "source_inspection",
          "path": "scripts/crm_execution_crew/kernel/contracts.mjs",
          "verifiedAt": "2026-07-13",
          "claim": "The inspected v1 contract and crew validate supported CRM flows against Twenty metadata; no standalone local front door exists."
        }
      ],
      "supportedModes": [
        "read_only"
      ],
      "effects": [],
      "domainSpan": "single_domain",
      "dataClasses": [
        "internal",
        "commercial",
        "pii"
      ],
      "reversibility": "reversible",
      "approvalTier": "none",
      "environmentAllowlist": [
        "test",
        "sandbox",
        "production"
      ],
      "scopeLimits": {
        "maxRecords": 200,
        "maxDocuments": 0,
        "maxRecipients": 0,
        "maxLocalArtifacts": 0,
        "allowExternalSend": false,
        "allowMetadataMutation": false,
        "allowDestructive": false,
        "allowWorkflowActivation": false
      },
      "currentEntrypoints": [
        "yarn crm:execute",
        "yarn crm:review"
      ],
      "inputContract": {
        "target": "./operation-envelope.schema.json#/$defs/OperationRequest",
        "current": [
          "scripts/crm_execution_crew/kernel/contracts.mjs"
        ]
      },
      "outputContract": {
        "target": "./operation-envelope.schema.json#/$defs/OperationResult",
        "current": []
      },
      "lastVerifiedAt": "2026-07-13",
      "aliases": [],
      "deprecatedBy": null,
      "notes": "Metadata can validate an allowlisted request but never authorize a newly discovered object or operation."
    },
    {
      "id": "crm.schema.introspect",
      "domain": "crm",
      "ownerComponent": "crm-core",
      "routingExposure": "internal",
      "lifecycleStatus": "planned",
      "semanticMaturity": "unknown",
      "runtimeReadiness": "not_implemented",
      "frontDoorReadiness": "not_implemented",
      "testLevel": "unknown",
      "evidence": [],
      "supportedModes": [
        "read_only"
      ],
      "effects": [],
      "domainSpan": "single_domain",
      "dataClasses": [
        "internal"
      ],
      "reversibility": "reversible",
      "approvalTier": "none",
      "environmentAllowlist": [
        "test",
        "sandbox",
        "production"
      ],
      "scopeLimits": {
        "maxRecords": 200,
        "maxDocuments": 0,
        "maxRecipients": 0,
        "maxLocalArtifacts": 0,
        "allowExternalSend": false,
        "allowMetadataMutation": false,
        "allowDestructive": false,
        "allowWorkflowActivation": false
      },
      "currentEntrypoints": [],
      "inputContract": {
        "target": "./operation-envelope.schema.json#/$defs/OperationRequest",
        "current": []
      },
      "outputContract": {
        "target": "./operation-envelope.schema.json#/$defs/OperationResult",
        "current": []
      },
      "lastVerifiedAt": null,
      "aliases": [],
      "deprecatedBy": null,
      "notes": "No canonical GraphQL/REST schema introspection capability was found; discovery remains non-authoritative."
    },
    {
      "id": "crm.record.search",
      "domain": "crm",
      "ownerComponent": "crm-core",
      "routingExposure": "public",
      "lifecycleStatus": "active",
      "semanticMaturity": "partial",
      "runtimeReadiness": "read_only",
      "frontDoorReadiness": "not_implemented",
      "testLevel": "unknown",
      "evidence": [
        {
          "type": "source_inspection",
          "path": "scripts/crm_execution_crew",
          "verifiedAt": "2026-07-13",
          "claim": "Current resolvers search records for the bounded v1 operation vocabulary, not arbitrary objects."
        }
      ],
      "supportedModes": [
        "read_only"
      ],
      "effects": [],
      "domainSpan": "single_domain",
      "dataClasses": [
        "commercial",
        "pii"
      ],
      "reversibility": "reversible",
      "approvalTier": "none",
      "environmentAllowlist": [
        "test"
      ],
      "scopeLimits": {
        "maxRecords": 200,
        "maxDocuments": 0,
        "maxRecipients": 0,
        "maxLocalArtifacts": 0,
        "allowExternalSend": false,
        "allowMetadataMutation": false,
        "allowDestructive": false,
        "allowWorkflowActivation": false
      },
      "currentEntrypoints": [
        "yarn crm:execute",
        "yarn crm:review"
      ],
      "inputContract": {
        "target": "./operation-envelope.schema.json#/$defs/OperationRequest",
        "current": [
          "scripts/crm_execution_crew/kernel/contracts.mjs"
        ]
      },
      "outputContract": {
        "target": "./operation-envelope.schema.json#/$defs/OperationResult",
        "current": []
      },
      "lastVerifiedAt": "2026-07-13",
      "aliases": [],
      "deprecatedBy": null,
      "notes": "Current behavior is deal- and operation-centric, so generic search maturity remains partial."
    },
    {
      "id": "crm.record.get",
      "domain": "crm",
      "ownerComponent": "crm-core",
      "routingExposure": "public",
      "lifecycleStatus": "active",
      "semanticMaturity": "partial",
      "runtimeReadiness": "read_only",
      "frontDoorReadiness": "not_implemented",
      "testLevel": "unknown",
      "evidence": [
        {
          "type": "source_inspection",
          "path": "scripts/crm_manual_update_crew",
          "verifiedAt": "2026-07-13",
          "claim": "Manual review and execution flows read deal context in bounded scenarios."
        }
      ],
      "supportedModes": [
        "read_only"
      ],
      "effects": [],
      "domainSpan": "single_domain",
      "dataClasses": [
        "commercial",
        "pii"
      ],
      "reversibility": "reversible",
      "approvalTier": "none",
      "environmentAllowlist": [
        "test",
        "sandbox",
        "production"
      ],
      "scopeLimits": {
        "maxRecords": 1,
        "maxDocuments": 0,
        "maxRecipients": 0,
        "maxLocalArtifacts": 0,
        "allowExternalSend": false,
        "allowMetadataMutation": false,
        "allowDestructive": false,
        "allowWorkflowActivation": false
      },
      "currentEntrypoints": [
        "yarn crm:execute",
        "yarn crm:review"
      ],
      "inputContract": {
        "target": "./operation-envelope.schema.json#/$defs/OperationRequest",
        "current": [
          "scripts/crm_execution_crew/kernel/contracts.mjs"
        ]
      },
      "outputContract": {
        "target": "./operation-envelope.schema.json#/$defs/OperationResult",
        "current": []
      },
      "lastVerifiedAt": "2026-07-13",
      "aliases": [],
      "deprecatedBy": null,
      "notes": "Exact-id and ambiguity checks are required; metadata discovery does not expand object access."
    },
    {
      "id": "crm.record.create",
      "domain": "crm",
      "ownerComponent": "crm-core",
      "routingExposure": "public",
      "lifecycleStatus": "active",
      "semanticMaturity": "partial",
      "runtimeReadiness": "apply_guarded",
      "frontDoorReadiness": "not_implemented",
      "testLevel": "unknown",
      "evidence": [
        {
          "type": "source_inspection",
          "path": "scripts/crm_execution_crew/kernel/contracts.mjs",
          "verifiedAt": "2026-07-13",
          "claim": "The v1 operation vocabulary includes create_opportunity under dry-run/apply constraints."
        }
      ],
      "supportedModes": [
        "dry_run",
        "apply"
      ],
      "effects": [
        "crm_write"
      ],
      "domainSpan": "single_domain",
      "dataClasses": [
        "commercial",
        "pii"
      ],
      "reversibility": "compensatable",
      "approvalTier": "owner",
      "environmentAllowlist": [
        "test",
        "sandbox",
        "production"
      ],
      "scopeLimits": {
        "maxRecords": 200,
        "maxDocuments": 0,
        "maxRecipients": 0,
        "maxLocalArtifacts": 0,
        "allowExternalSend": false,
        "allowMetadataMutation": false,
        "allowDestructive": false,
        "allowWorkflowActivation": false
      },
      "currentEntrypoints": [
        "yarn crm:execute --request-file=... --apply --yes",
        "yarn crm:review"
      ],
      "inputContract": {
        "target": "./operation-envelope.schema.json#/$defs/OperationRequest",
        "current": [
          "scripts/crm_execution_crew/kernel/contracts.mjs"
        ]
      },
      "outputContract": {
        "target": "./operation-envelope.schema.json#/$defs/OperationResult",
        "current": []
      },
      "lastVerifiedAt": "2026-07-13",
      "aliases": [],
      "deprecatedBy": null,
      "notes": "Target CRM Core is metadata-aware and explicitly allowlisted; this is not universal create."
    },
    {
      "id": "crm.record.update",